{
  "repositoryId": "REAL-REPO-001",
  "repositoryName": "Todo-Application",
  "repositoryUrl": "https://github.com/darshanrathod04/Todo-Application.git",
  "commitSha": "bb4b69a50ee814d00129fdbe2286eeaa048a078f",
  "analysisDate": "2026-10-02T16:59:49Z",
  "language": "Java 21",
  "framework": "Spring Boot 4.1.0",
  "sentinelPrVersion": "1.1.4 (commit c051ebb8eb4003984a9af21d689aa642d119aa73)",
  "rulesEvaluated": [
    "SEC-001-FAIL-OPEN",
    "SEC-002-UNCLOSED-STREAM",
    "SEC-003-VOLATILE-COMPOUND",
    "SEC-004-UNISOLATED-SUBPROCESS",
    "SEC-005-SQL-INJECTION",
    "SEC-006-PATH-TRAVERSAL",
    "SEC-007-INSECURE-DESERIALIZATION",
    "SEC-008-HARDCODED-SECRET",
    "SEC-009-SPRING-SECURITY-CSRF-DISABLED",
    "SEC-010-SPRING-PERMISSIVE-CORS",
    "ARCH-001-CYCLIC-DEPENDENCY",
    "ARCH-002-LEAKY-ABSTRACTION",
    "ARCH-003-NON-DETERMINISTIC-CALLS"
  ],
  "findings": [
    {
      "observationId": "OBS-0001",
      "ruleId": "ARCH-002-LEAKY-ABSTRACTION",
      "severity": "HIGH",
      "file": "src/main/java/com/application/todoList/controller/TaskController.java",
      "line": 19,
      "findingDescription": "Leaky abstraction: Endpoint 'addtask' accepts and returns internal database entity 'Task' without DTO encapsulation",
      "evidence": "@PostMapping\npublic Task addtask(@RequestBody Task task){\n    return service.createTask(task);\n}",
      "classification": "FN",
      "classificationConfidence": 0.95,
      "groundTruthEvidence": "Task is an annotated JPA database persistence entity (@Entity in Task.java). TaskController endpoints (addtask line 19, getTasks line 24, updateTask line 29) directly consume and return Task without DTO or record mapping. This violates CWE-497 (leaky abstraction) and exposes the application to mass-assignment over-posting on entity field 'id'. SentinelPR's ArchitectureReviewEngine missed this finding because its isEntityType heuristic only checks if the simple class name ends with 'Entity' or imports persistence.Entity locally, failing to resolve the cross-file AST declaration of Task.",
      "remediationAttempted": false,
      "remediationResult": "NOT_ATTEMPTED",
      "reviewerNotes": "Engine defect in ArchitectureReviewEngine.isEntityType(): lacks cross-file symbol resolution to detect @Entity on referenced types."
    },
    {
      "observationId": "OBS-0002",
      "ruleId": "SEC-001-FAIL-OPEN",
      "severity": "INFO",
      "file": "src/main/java/com/application/todoList/service/TaskService.java",
      "line": 26,
      "findingDescription": "Fail-open security evaluation on TaskService exception handling",
      "evidence": "Task task = taskRepo.findById(id).orElseThrow(() -> new RuntimeException(\"task not found\"));",
      "classification": "TN",
      "classificationConfidence": 1.0,
      "groundTruthEvidence": "No try-catch blocks exist in the codebase. Optional unwrapping uses orElseThrow(), which propagates RuntimeException/NoSuchElementException rather than swallowing exceptions and granting unauthorized access. Evaluated safe.",
      "remediationAttempted": false,
      "remediationResult": "NOT_ATTEMPTED"
    },
    {
      "observationId": "OBS-0003",
      "ruleId": "SEC-002-UNCLOSED-STREAM",
      "severity": "INFO",
      "file": "src/main/java/com/application/todoList/TodoListApplication.java",
      "line": 7,
      "findingDescription": "I/O stream lifecycle evaluation across repository",
      "evidence": "public class TodoListApplication",
      "classification": "TN",
      "classificationConfidence": 1.0,
      "groundTruthEvidence": "No unmanaged I/O streams or file descriptors (FileInputStream, FileOutputStream, etc.) are opened in the repository. Evaluated safe.",
      "remediationAttempted": false,
      "remediationResult": "NOT_ATTEMPTED"
    },
    {
      "observationId": "OBS-0004",
      "ruleId": "SEC-003-VOLATILE-COMPOUND",
      "severity": "INFO",
      "file": "src/main/java/com/application/todoList/entity/Task.java",
      "line": 8,
      "findingDescription": "Concurrency and volatile field inspection across entities and services",
      "evidence": "public class Task",
      "classification": "TN",
      "classificationConfidence": 1.0,
      "groundTruthEvidence": "No volatile field declarations or compound mutations on volatile fields exist in the repository. Evaluated safe.",
      "remediationAttempted": false,
      "remediationResult": "NOT_ATTEMPTED"
    },
    {
      "observationId": "OBS-0005",
      "ruleId": "SEC-004-UNISOLATED-SUBPROCESS",
      "severity": "INFO",
      "file": "src/main/java/com/application/todoList/service/TaskService.java",
      "line": 13,
      "findingDescription": "Subprocess execution inspection across business logic",
      "evidence": "public class TaskService",
      "classification": "TN",
      "classificationConfidence": 1.0,
      "groundTruthEvidence": "No ProcessBuilder or Runtime.exec invocations exist in the repository. Evaluated safe.",
      "remediationAttempted": false,
      "remediationResult": "NOT_ATTEMPTED"
    },
    {
      "observationId": "OBS-0006",
      "ruleId": "SEC-005-SQL-INJECTION",
      "severity": "INFO",
      "file": "src/main/java/com/application/todoList/repository/TaskRepo.java",
      "line": 7,
      "findingDescription": "SQL injection vulnerability inspection on database access layer",
      "evidence": "public interface TaskRepo extends JpaRepository<Task, Long>",
      "classification": "TN",
      "classificationConfidence": 1.0,
      "groundTruthEvidence": "All database operations are mediated entirely through Spring Data JpaRepository methods (save, findAll, findById, delete) with parameterized query binding. No raw SQL queries, EntityManager createQuery string concatenations, or unparameterized queries exist. Evaluated safe.",
      "remediationAttempted": false,
      "remediationResult": "NOT_ATTEMPTED"
    },
    {
      "observationId": "OBS-0007",
      "ruleId": "SEC-006-PATH-TRAVERSAL",
      "severity": "INFO",
      "file": "src/main/java/com/application/todoList/controller/TaskController.java",
      "line": 14,
      "findingDescription": "Path traversal inspection on controller endpoints",
      "evidence": "public class TaskController",
      "classification": "TN",
      "classificationConfidence": 1.0,
      "groundTruthEvidence": "No File, Path, or filesystem operations accept user input or parameters in the repository. Evaluated safe.",
      "remediationAttempted": false,
      "remediationResult": "NOT_ATTEMPTED"
    },
    {
      "observationId": "OBS-0008",
      "ruleId": "SEC-007-INSECURE-DESERIALIZATION",
      "severity": "INFO",
      "file": "src/main/java/com/application/todoList/controller/TaskController.java",
      "line": 19,
      "findingDescription": "Deserialization inspection on REST payload ingress",
      "evidence": "public Task addtask(@RequestBody Task task)",
      "classification": "TN",
      "classificationConfidence": 1.0,
      "groundTruthEvidence": "REST payloads are parsed via standard Spring Web Jackson JSON deserializer. No native Java ObjectInputStream.readObject() calls exist. Evaluated safe.",
      "remediationAttempted": false,
      "remediationResult": "NOT_ATTEMPTED"
    },
    {
      "observationId": "OBS-0009",
      "ruleId": "SEC-008-HARDCODED-SECRET",
      "severity": "INFO",
      "file": "src/main/java/com/application/todoList/TodoListApplication.java",
      "line": 7,
      "findingDescription": "Hardcoded secret inspection across source code and properties",
      "evidence": "public class TodoListApplication",
      "classification": "TN",
      "classificationConfidence": 1.0,
      "groundTruthEvidence": "No API keys, private tokens, passwords, or cloud credentials are embedded in Java source files. application.properties configures an empty datasource password. Evaluated safe.",
      "remediationAttempted": false,
      "remediationResult": "NOT_ATTEMPTED"
    },
    {
      "observationId": "OBS-0010",
      "ruleId": "SEC-009-SPRING-SECURITY-CSRF-DISABLED",
      "severity": "INFO",
      "file": "src/main/java/com/application/todoList/TodoListApplication.java",
      "line": 7,
      "findingDescription": "CSRF protection inspection on Spring Security configuration",
      "evidence": "public class TodoListApplication",
      "classification": "TN",
      "classificationConfidence": 1.0,
      "groundTruthEvidence": "Spring Security is not present in pom.xml and no SecurityFilterChain bean disables CSRF. Evaluated safe.",
      "remediationAttempted": false,
      "remediationResult": "NOT_ATTEMPTED"
    },
    {
      "observationId": "OBS-0011",
      "ruleId": "SEC-010-SPRING-PERMISSIVE-CORS",
      "severity": "INFO",
      "file": "src/main/java/com/application/todoList/controller/TaskController.java",
      "line": 13,
      "findingDescription": "Permissive CORS origin inspection on REST controller",
      "evidence": "@CrossOrigin(origins = \"http://localhost:63342\")",
      "classification": "TN",
      "classificationConfidence": 1.0,
      "groundTruthEvidence": "The @CrossOrigin annotation restricts allowed origins to 'http://localhost:63342' (local IDE preview port). It does not use wildcard '*' origin. FrameworkContextAnalyzer correctly identified this as non-permissive under CWE-942. Evaluated safe.",
      "remediationAttempted": false,
      "remediationResult": "NOT_ATTEMPTED"
    },
    {
      "observationId": "OBS-0012",
      "ruleId": "ARCH-001-CYCLIC-DEPENDENCY",
      "severity": "INFO",
      "file": "src/main/java/com/application/todoList/controller/TaskController.java",
      "line": 14,
      "findingDescription": "Architectural cycle evaluation across package graph",
      "evidence": "TaskController -> TaskService -> TaskRepo -> Task",
      "classification": "TN",
      "classificationConfidence": 1.0,